{
  "$id": "https://bitbucket.org/wunderbon/json-schemas/raw/master/schema/location/location.schema.json",
  "$schema": "http://json-schema.org/draft-04/schema#",
  "version": "0.0.1",
  "contact": {
    "name": "wunderbon support",
    "url": "https://wunderbon.io/support",
    "email": "api-support@wunderbon.io"
  },
  "title": "Location",
  "description": "Location representation within the wunderbon domain.",
  "type": "object",
  "properties": {
    "name": {
      "type": "object",
      "oneOf": [
        {
          "$ref": "https://bitbucket.org/wunderbon/json-schemas/raw/master/schema/name/legal/name.schema.json"
        },
        {
          "$ref": "https://bitbucket.org/wunderbon/json-schemas/raw/master/schema/name/private/name.schema.json"
        }
      ]
    },
    "address": {
      "$ref": "https://bitbucket.org/wunderbon/json-schemas/raw/master/schema/address/address.schema.json"
    },
    "communication": {
      "$ref": "https://bitbucket.org/wunderbon/json-schemas/raw/master/schema/communication/communication.schema.json"
    },
    "taxId": {
      "type": "string",
      "oneOf": [
        {
          "$ref": "https://bitbucket.org/wunderbon/json-schemas/raw/master/schema/tax/id/eu/id.schema.json"
        }
      ]
    },
    "serviceTime": {
      "type": "array",
      "items": [
        {
          "$ref": "https://bitbucket.org/wunderbon/json-schemas/raw/master/schema/serviceTime/serviceTime.schema.json"
        }
      ],
      "minItems": 1,
      "maxItems": 7,
      "uniqueItems": true
    },
    "posData": {
      "$ref": "https://bitbucket.org/wunderbon/json-schemas/raw/master/schema/posData/posData.schema.json"
    }
  },
  "additionalProperties": false,
  "required": [
    "address",
    "serviceTime",
    "posData"
  ]
}
